{"as_of":"2026-09-15","parameters":{"root_fund_id":"FUND-A","max_depth":5},"data_contract":{"provider":"synthetic","mapping_id":"fund-penetration","mapping_version":"1.0.0","units":{"weight":"record_declared_decimal_or_percent","output_weight":"decimal"},"date_semantics":"holding_disclosure_date","adjustment":"not_applicable"},"dataset_refs":[{"dataset_id":"fixture-fund-penetration","provider_id":"synthetic","as_of":"2026-09-15","sha256":"60005575f0b72949dc826f4c2a763c7d6e79d14513019a9eef80b4619a2147ee"}],"source_hashes":{"synthetic":"60005575f0b72949dc826f4c2a763c7d6e79d14513019a9eef80b4619a2147ee"},"records":[{"owner_id":"FUND-A","holding_id":"FUND-B","holding_type":"fund","weight":50,"weight_unit":"percent","as_of":"2026-09-15"},{"owner_id":"FUND-A","holding_id":"STOCK-X","holding_type":"security","weight":25,"weight_unit":"percent","as_of":"2026-09-15"},{"owner_id":"FUND-A","holding_id":"STOCK-Y","holding_type":"security","weight":0.25,"weight_unit":"decimal","as_of":"2026-09-15"},{"owner_id":"FUND-B","holding_id":"STOCK-X","holding_type":"security","weight":40,"weight_unit":"percent","as_of":"2026-09-15"},{"owner_id":"FUND-B","holding_id":"STOCK-Z","holding_type":"security","weight":60,"weight_unit":"percent","as_of":"2026-09-15"}]}
